<?xml version="1.0" encoding="UTF-8"?>
<!--
  #%L
  DROOLS SERVER :: Model
  $Id:$
  $HeadURL:$
  %%
  Copyright (C) 2013 Leadware
  %%
  Licensed under the Apache License, Version 2.0 (the "License");
  you may not use this file except in compliance with the License.
  You may obtain a copy of the License at
  
       http://www.apache.org/licenses/LICENSE-2.0
  
  Unless required by applicable law or agreed to in writing, software
  distributed under the License is distributed on an "AS IS" BASIS,
  WITHOUT WARRANTIES OR CONDITIONS OF ANY KIND, either express or implied.
  See the License for the specific language governing permissions and
  limitations under the License.
  #L%
  -->

<drools-server xmlns="http://www.example.org/drools-server-configuration" xmlns:xsi="http://www.w3.org/2001/XMLSchema-instance" xsi:schemaLocation="http://www.example.org/drools-server-configuration ../../../main/resources/xsd/drools-server-configuration.xsd ">
	
	<!--
	  Copyright [2013] - 24/12/2013 by Leadware.
	
	  Licensed under the Apache License, Version 2.0 (the "License");
	  you may not use this file except in compliance with the License.
	  You may obtain a copy of the License at
	
	      http://www.apache.org/licenses/LICENSE-2.0
	
	  Unless required by applicable law or agreed to in writing, software
	  distributed under the License is distributed on an "AS IS" BASIS,
	  WITHOUT WARRANTIES OR CONDITIONS OF ANY KIND, either express or implied.
	  See the License for the specific language governing permissions and
	  limitations under the License.
	
	  $24/12/2013$
  	-->
  	
	<knowledge-session name="ksession1" type="STATELESS">
		<knowledge-agent name="my-agent" >
			<resource path="" type="DRL"/>
			<resource path="" type="CHANGE_SET"/>
			<resource path="" type="XSD"/>
		</knowledge-agent>
	</knowledge-session>
	<knowledge-session name="ksession2" type="STATEFUL">
		<knowledge-base>
			<resource path="" inClassPath="false" type="DRL"/>
		</knowledge-base>
	</knowledge-session>
</drools-server>
